{
  "schemaVersion": "1.0.0",
  "evaluatorVersion": "calibration-evaluator/0.1.0",
  "metricVersion": "calibration-metrics/1.0.0",
  "corpusId": "efforthours-public-readiness-validation",
  "corpusVersion": "1.3.0",
  "partition": "validation",
  "recordCount": 9,
  "repositoryCount": 9,
  "ignoredCandidateCount": 0,
  "candidateEstimatorVersions": [
    "seed-rules/0.4.0"
  ],
  "repositoryTotals": {
    "low": {
      "sampleCount": 9,
      "reviewedHours": 37809.00,
      "candidateHours": 28559.00,
      "meanAbsoluteErrorHours": 1027.7778,
      "medianAbsoluteErrorHours": 318.75,
      "rootMeanSquaredErrorHours": 1655.4321,
      "meanSignedErrorHours": -1027.7778,
      "weightedAbsolutePercentageError": 0.2447,
      "aggregateBiasRate": -0.2447
    },
    "expected": {
      "sampleCount": 9,
      "reviewedHours": 46045.50,
      "candidateHours": 56337.75,
      "meanAbsoluteErrorHours": 1166.1944,
      "medianAbsoluteErrorHours": 127.75,
      "rootMeanSquaredErrorHours": 2106.8416,
      "meanSignedErrorHours": 1143.5833,
      "weightedAbsolutePercentageError": 0.2279,
      "aggregateBiasRate": 0.2235
    },
    "high": {
      "sampleCount": 9,
      "reviewedHours": 56110.25,
      "candidateHours": 101798.75,
      "meanAbsoluteErrorHours": 5076.50,
      "medianAbsoluteErrorHours": 549.75,
      "rootMeanSquaredErrorHours": 8396.7104,
      "meanSignedErrorHours": 5076.50,
      "weightedAbsolutePercentageError": 0.8143,
      "aggregateBiasRate": 0.8143
    },
    "interval": {
      "sampleCount": 9,
      "reviewedExpectedCoveredCount": 9,
      "reviewedExpectedCoverage": 1,
      "reviewedRangeFullyCoveredCount": 9,
      "reviewedRangeFullyCoveredRate": 1,
      "meanCandidateWidthHours": 8137.75,
      "meanReviewedWidthHours": 2033.4722
    }
  },
  "categories": [
    {
      "category": "specification-comprehension-and-domain-learning",
      "metrics": {
        "low": {
          "sampleCount": 9,
          "reviewedHours": 401.00,
          "candidateHours": 98.75,
          "meanAbsoluteErrorHours": 33.5833,
          "medianAbsoluteErrorHours": 22.50,
          "rootMeanSquaredErrorHours": 42.4877,
          "meanSignedErrorHours": -33.5833,
          "weightedAbsolutePercentageError": 0.7537,
          "aggregateBiasRate": -0.7537
        },
        "expected": {
          "sampleCount": 9,
          "reviewedHours": 485,
          "candidateHours": 182.25,
          "meanAbsoluteErrorHours": 33.6389,
          "medianAbsoluteErrorHours": 24.00,
          "rootMeanSquaredErrorHours": 43.9661,
          "meanSignedErrorHours": -33.6389,
          "weightedAbsolutePercentageError": 0.6242,
          "aggregateBiasRate": -0.6242
        },
        "high": {
          "sampleCount": 9,
          "reviewedHours": 587.25,
          "candidateHours": 322.00,
          "meanAbsoluteErrorHours": 29.4722,
          "medianAbsoluteErrorHours": 19.25,
          "rootMeanSquaredErrorHours": 44.8847,
          "meanSignedErrorHours": -29.4722,
          "weightedAbsolutePercentageError": 0.4517,
          "aggregateBiasRate": -0.4517
        },
        "interval": {
          "sampleCount": 9,
          "reviewedExpectedCoveredCount": 1,
          "reviewedExpectedCoverage": 0.1111,
          "reviewedRangeFullyCoveredCount": 0,
          "reviewedRangeFullyCoveredRate": 0,
          "meanCandidateWidthHours": 24.8056,
          "meanReviewedWidthHours": 20.6944
        }
      }
    },
    {
      "category": "repository-and-solution-setup",
      "metrics": {
        "low": {
          "sampleCount": 9,
          "reviewedHours": 818.50,
          "candidateHours": 649.00,
          "meanAbsoluteErrorHours": 18.8333,
          "medianAbsoluteErrorHours": 11.00,
          "rootMeanSquaredErrorHours": 24.9561,
          "meanSignedErrorHours": -18.8333,
          "weightedAbsolutePercentageError": 0.2071,
          "aggregateBiasRate": -0.2071
        },
        "expected": {
          "sampleCount": 9,
          "reviewedHours": 1032.50,
          "candidateHours": 1056.50,
          "meanAbsoluteErrorHours": 11.9444,
          "medianAbsoluteErrorHours": 7.75,
          "rootMeanSquaredErrorHours": 20.3668,
          "meanSignedErrorHours": 2.6667,
          "weightedAbsolutePercentageError": 0.1041,
          "aggregateBiasRate": 0.0232
        },
        "high": {
          "sampleCount": 9,
          "reviewedHours": 1289.75,
          "candidateHours": 1645.25,
          "meanAbsoluteErrorHours": 41.3333,
          "medianAbsoluteErrorHours": 3.00,
          "rootMeanSquaredErrorHours": 78.9413,
          "meanSignedErrorHours": 39.50,
          "weightedAbsolutePercentageError": 0.2884,
          "aggregateBiasRate": 0.2756
        },
        "interval": {
          "sampleCount": 9,
          "reviewedExpectedCoveredCount": 8,
          "reviewedExpectedCoverage": 0.8889,
          "reviewedRangeFullyCoveredCount": 6,
          "reviewedRangeFullyCoveredRate": 0.6667,
          "meanCandidateWidthHours": 110.6944,
          "meanReviewedWidthHours": 52.3611
        }
      }
    },
    {
      "category": "architecture-and-technical-design",
      "metrics": {
        "low": {
          "sampleCount": 9,
          "reviewedHours": 1005.00,
          "candidateHours": 625.75,
          "meanAbsoluteErrorHours": 42.3611,
          "medianAbsoluteErrorHours": 5.50,
          "rootMeanSquaredErrorHours": 87.6758,
          "meanSignedErrorHours": -42.1389,
          "weightedAbsolutePercentageError": 0.3794,
          "aggregateBiasRate": -0.3774
        },
        "expected": {
          "sampleCount": 9,
          "reviewedHours": 1227.75,
          "candidateHours": 1185.75,
          "meanAbsoluteErrorHours": 10.6667,
          "medianAbsoluteErrorHours": 5.75,
          "rootMeanSquaredErrorHours": 20.5535,
          "meanSignedErrorHours": -4.6667,
          "weightedAbsolutePercentageError": 0.0782,
          "aggregateBiasRate": -0.0342
        },
        "high": {
          "sampleCount": 9,
          "reviewedHours": 1495.50,
          "candidateHours": 2199.75,
          "meanAbsoluteErrorHours": 80.3611,
          "medianAbsoluteErrorHours": 15.25,
          "rootMeanSquaredErrorHours": 144.5146,
          "meanSignedErrorHours": 78.25,
          "weightedAbsolutePercentageError": 0.4836,
          "aggregateBiasRate": 0.4709
        },
        "interval": {
          "sampleCount": 9,
          "reviewedExpectedCoveredCount": 8,
          "reviewedExpectedCoverage": 0.8889,
          "reviewedRangeFullyCoveredCount": 7,
          "reviewedRangeFullyCoveredRate": 0.7778,
          "meanCandidateWidthHours": 174.8889,
          "meanReviewedWidthHours": 54.50
        }
      }
    },
    {
      "category": "production-implementation",
      "metrics": {
        "low": {
          "sampleCount": 9,
          "reviewedHours": 18444.50,
          "candidateHours": 15782.75,
          "meanAbsoluteErrorHours": 392.9167,
          "medianAbsoluteErrorHours": 51.00,
          "rootMeanSquaredErrorHours": 697.0750,
          "meanSignedErrorHours": -295.75,
          "weightedAbsolutePercentageError": 0.1917,
          "aggregateBiasRate": -0.1443
        },
        "expected": {
          "sampleCount": 9,
          "reviewedHours": 22444.25,
          "candidateHours": 31723.50,
          "meanAbsoluteErrorHours": 1033.9167,
          "medianAbsoluteErrorHours": 185.00,
          "rootMeanSquaredErrorHours": 2126.3762,
          "meanSignedErrorHours": 1031.0278,
          "weightedAbsolutePercentageError": 0.4146,
          "aggregateBiasRate": 0.4134
        },
        "high": {
          "sampleCount": 9,
          "reviewedHours": 27345.00,
          "candidateHours": 57690.50,
          "meanAbsoluteErrorHours": 3371.7222,
          "medianAbsoluteErrorHours": 587.75,
          "rootMeanSquaredErrorHours": 6097.1830,
          "meanSignedErrorHours": 3371.7222,
          "weightedAbsolutePercentageError": 1.1097,
          "aggregateBiasRate": 1.1097
        },
        "interval": {
          "sampleCount": 9,
          "reviewedExpectedCoveredCount": 8,
          "reviewedExpectedCoverage": 0.8889,
          "reviewedRangeFullyCoveredCount": 5,
          "reviewedRangeFullyCoveredRate": 0.5556,
          "meanCandidateWidthHours": 4656.4167,
          "meanReviewedWidthHours": 988.9444
        }
      }
    },
    {
      "category": "ui-implementation-and-represented-ux-decisions",
      "metrics": {
        "low": {
          "sampleCount": 7,
          "reviewedHours": 2435.50,
          "candidateHours": 708.00,
          "meanAbsoluteErrorHours": 249.8571,
          "medianAbsoluteErrorHours": 12.50,
          "rootMeanSquaredErrorHours": 513.1746,
          "meanSignedErrorHours": -246.7857,
          "weightedAbsolutePercentageError": 0.7181,
          "aggregateBiasRate": -0.7093
        },
        "expected": {
          "sampleCount": 7,
          "reviewedHours": 2964.50,
          "candidateHours": 1720.25,
          "meanAbsoluteErrorHours": 191.3214,
          "medianAbsoluteErrorHours": 15.50,
          "rootMeanSquaredErrorHours": 434.6366,
          "meanSignedErrorHours": -177.75,
          "weightedAbsolutePercentageError": 0.4518,
          "aggregateBiasRate": -0.4197
        },
        "high": {
          "sampleCount": 7,
          "reviewedHours": 3614.75,
          "candidateHours": 3509.75,
          "meanAbsoluteErrorHours": 169.0714,
          "medianAbsoluteErrorHours": 67.25,
          "rootMeanSquaredErrorHours": 274.5308,
          "meanSignedErrorHours": -15.00,
          "weightedAbsolutePercentageError": 0.3274,
          "aggregateBiasRate": -0.0290
        },
        "interval": {
          "sampleCount": 7,
          "reviewedExpectedCoveredCount": 4,
          "reviewedExpectedCoverage": 0.5714,
          "reviewedRangeFullyCoveredCount": 4,
          "reviewedRangeFullyCoveredRate": 0.5714,